{
  "$schema": "../schema/token-spec.schema.json",
  "name": "read-only-auditor",
  "description": "Read-only auditing of repository contents + metadata. No write anywhere.",
  "expiration": 90,
  "repositoryAccess": { "mode": "selected", "repos": ["terrylica/cc-skills"] },
  "permissions": {
    "repository": { "Contents": "read" }
  }
}
